{
  "schemaVersion": 2,
  "benchmarkInstanceSchemaVersion": 2,
  "name": "hard-coverage-pilot-v1",
  "releaseId": "hard-coverage-pilot-v1",
  "suite": "hard",
  "partition": "coverage-pilot",
  "targetIds": [
    "hard-main-004",
    "hard-main-010",
    "hard-side-021",
    "hard-side-039",
    "hard-side-041"
  ],
  "candidateCount": 8,
  "acceptedCount": 5,
  "rejectedCount": 3,
  "instances": [
    {
      "schemaVersion": 2,
      "id": "hard-main-004-coverage-01",
      "suite": "hard",
      "track": "main",
      "targetId": "hard-main-004",
      "target": "--SmSm--:SrRmRmCm:----CwCw",
      "partition": "coverage-pilot",
      "inputs": [
        {
          "shape": "----SuCu",
          "count": 1
        },
        {
          "shape": "--CuWuSu",
          "count": 1
        },
        {
          "shape": "--RuRuWu",
          "count": 1
        },
        {
          "shape": "--Su--Wu",
          "count": 1
        },
        {
          "shape": "--SuSuCu",
          "count": 1
        },
        {
          "shape": "Cu--Ru--",
          "count": 1
        },
        {
          "shape": "CuCu----",
          "count": 1
        }
      ],
      "rules": {
        "maxLayers": 4,
        "cleanPainting": true,
        "allowSplitting": false
      },
      "provenance": {
        "releaseId": "hard-coverage-pilot-v1",
        "generatorVersion": "multi-strategy-v2",
        "generatorSourceSha256": "c9dbb79033201af00114d64807f193fc48a2c20c1edbb45b66e60f080ffc2ceb",
        "targetSha256": "2183dca26a00cf92caa9869c807ca6604bfa0cd44db12f12619d02a337b6826b",
        "officialTargetsSha256": "f400bd27f2c68a56b0dc0fc5c8c793ecc7c2f621d49883f52214a9f2cbb63a0c",
        "catalogVersion": 1,
        "catalogSha256": "55e8b1ab934b0a7447b16bf4fb1113ec6aaff7c5c279bfde6d293acd0493466a",
        "inputSeedIdentity": "owner-input-seed-v1",
        "inputSeedSha256": "f8ff83ec06f414e75024df6c591891f86aba00709948290ac730e61934db7c59",
        "gameSemanticsId": "shape-operations-v1",
        "gameSemanticsSha256": "066085c4182a663326fa8f02b367aa00a2a036c4a44558efc2514e7ff099dfa5"
      },
      "construction": {
        "strategy": "catalog-half-chunk+multi-stage-stack"
      },
      "witness": {
        "initial": [
          {
            "id": 0,
            "shape": "----SuCu"
          },
          {
            "id": 7,
            "shape": "--CuWuSu"
          },
          {
            "id": 17,
            "shape": "--Su--Wu"
          },
          {
            "id": 24,
            "shape": "--RuRuWu"
          },
          {
            "id": 31,
            "shape": "Cu--Ru--"
          },
          {
            "id": 35,
            "shape": "--SuSuCu"
          },
          {
            "id": 48,
            "shape": "CuCu----"
          }
        ],
        "steps": [
          {
            "operation": "Rotator CW",
            "inputs": [
              0
            ],
            "outputs": [
              {
                "id": 1,
                "shape": "Cu----Su"
              }
            ],
            "params": {}
          },
          {
            "operation": "Cutter",
            "inputs": [
              1
            ],
            "outputs": [
              {
                "id": 2,
                "shape": "------Su"
              },
              {
                "id": 3,
                "shape": "Cu------"
              }
            ],
            "params": {}
          },
          {
            "operation": "Rotator CW",
            "inputs": [
              2
            ],
            "outputs": [
              {
                "id": 4,
                "shape": "Su------"
              }
            ],
            "params": {}
          },
          {
            "operation": "Rotator CW",
            "inputs": [
              4
            ],
            "outputs": [
              {
                "id": 5,
                "shape": "--Su----"
              }
            ],
            "params": {}
          },
          {
            "operation": "Painter",
            "inputs": [
              5
            ],
            "outputs": [
              {
                "id": 6,
                "shape": "--Sm----"
              }
            ],
            "params": {
              "color": "m"
            }
          },
          {
            "operation": "Cutter",
            "inputs": [
              7
            ],
            "outputs": [
              {
                "id": 8,
                "shape": "----WuSu"
              },
              {
                "id": 9,
                "shape": "--Cu----"
              }
            ],
            "params": {}
          },
          {
            "operation": "Rotator CW",
            "inputs": [
              8
            ],
            "outputs": [
              {
                "id": 10,
                "shape": "Su----Wu"
              }
            ],
            "params": {}
          },
          {
            "operation": "Cutter",
            "inputs": [
              10
            ],
            "outputs": [
              {
                "id": 11,
                "shape": "------Wu"
              },
              {
                "id": 12,
                "shape": "Su------"
              }
            ],
            "params": {}
          },
          {
            "operation": "Rotator CW",
            "inputs": [
              12
            ],
            "outputs": [
              {
                "id": 13,
                "shape": "--Su----"
              }
            ],
            "params": {}
          },
          {
            "operation": "Rotator CW",
            "inputs": [
              13
            ],
            "outputs": [
              {
                "id": 14,
                "shape": "----Su--"
              }
            ],
            "params": {}
          },
          {
            "operation": "Painter",
            "inputs": [
              14
            ],
            "outputs": [
              {
                "id": 15,
                "shape": "----Sm--"
              }
            ],
            "params": {
              "color": "m"
            }
          },
          {
            "operation": "Stacker",
            "inputs": [
              6,
              15
            ],
            "outputs": [
              {
                "id": 16,
                "shape": "--SmSm--"
              }
            ],
            "params": {}
          },
          {
            "operation": "Cutter",
            "inputs": [
              17
            ],
            "outputs": [
              {
                "id": 18,
                "shape": "------Wu"
              },
              {
                "id": 19,
                "shape": "--Su----"
              }
            ],
            "params": {}
          },
          {
            "operation": "Rotator CW",
            "inputs": [
              19
            ],
            "outputs": [
              {
                "id": 20,
                "shape": "----Su--"
              }
            ],
            "params": {}
          },
          {
            "operation": "Rotator CW",
            "inputs": [
              20
            ],
            "outputs": [
              {
                "id": 21,
                "shape": "------Su"
              }
            ],
            "params": {}
          },
          {
            "operation": "Rotator CW",
            "inputs": [
              21
            ],
            "outputs": [
              {
                "id": 22,
                "shape": "Su------"
              }
            ],
            "params": {}
          },
          {
            "operation": "Painter",
            "inputs": [
              22
            ],
            "outputs": [
              {
                "id": 23,
                "shape": "Sr------"
              }
            ],
            "params": {
              "color": "r"
            }
          },
          {
            "operation": "Cutter",
            "inputs": [
              24
            ],
            "outputs": [
              {
                "id": 25,
                "shape": "----RuWu"
              },
              {
                "id": 26,
                "shape": "--Ru----"
              }
            ],
            "params": {}
          },
          {
            "operation": "Rotator CW",
            "inputs": [
              25
            ],
            "outputs": [
              {
                "id": 27,
                "shape": "Wu----Ru"
              }
            ],
            "params": {}
          },
          {
            "operation": "Cutter",
            "inputs": [
              27
            ],
            "outputs": [
              {
                "id": 28,
                "shape": "------Ru"
              },
              {
                "id": 29,
                "shape": "Wu------"
              }
            ],
            "params": {}
          },
          {
            "operation": "Painter",
            "inputs": [
              26
            ],
            "outputs": [
              {
                "id": 30,
                "shape": "--Rm----"
              }
            ],
            "params": {
              "color": "m"
            }
          },
          {
            "operation": "Cutter",
            "inputs": [
              31
            ],
            "outputs": [
              {
                "id": 32,
                "shape": "----Ru--"
              },
              {
                "id": 33,
                "shape": "Cu------"
              }
            ],
            "params": {}
          },
          {
            "operation": "Painter",
            "inputs": [
              32
            ],
            "outputs": [
              {
                "id": 34,
                "shape": "----Rm--"
              }
            ],